title,year,genre,plot
Nefarious,2022,"Crime, Thriller","A fast moving, funny and ultimately tragic European road movie about two hedonistic outlaws and their quest to open up a coffeeshop in Amsterdam."
Hellraiser,2022,"Horror, Mystery, Thriller","A take on Clive Barker's 1987 horror classic where a young woman struggling with addiction comes into possession of an ancient puzzle box, unaware that its purpose is to summon the Cenobites."
Milli Vanilli,2022,"Comedy, Drama",The story of one producer and two lip-syncing male models who would sell millions of records and win a Grammy before their scam was revealed.
Sirens,2022,Documentary,"Lilas and Shery, co-founders and guitarists of the Middle East's first all-female metal band, wrestle with friendship, sexuality and destruction in their pursuit of becoming thrash metal rock stars."
Bloody September,2022,Horror,"Theater and film actor, Mykola Veresen' dies on the set while performing the role of Ivan the Terrible. In the moment of death, his karma transforms into the bloody murderer he embodied, and he falls into Sheol, a common grave for all the dead. The time has a different flow here, the only feelings left are fear and pain. In hell Mykola learns about the confrontation that last for centuries between the white and black vampires, he becomes a puppet in the cruel guerrilla of these two supernatural groups."
Laal Singh Chaddha,2022,"Comedy, Drama, Romance","Laal Singh Chaddha, a simple man whose extraordinary journey will fill you with love, warmth, happiness and will also make you laugh."
MobSense,2022,Comedy,
Adventures in Game Chasing,2022,Comedy,"Billy and Jay, friends since kids and now beat down with life, go on an adventure to track down Billy's original NES gaming system in order to play it one more time."
The Christmas Spirit,2022,"Comedy, Thriller",A lone man with the Christmas Spirit trapped in his head must kidnap a teenage girl in order to save Christmas.
Darkling,2022,"Drama, Horror","Letter from a girl from Kosovo, dedicated to her missing father, read at the United Nations, in which she publicly addresses the difficult life of Serbs, especially Serb children in the enclaves."
Charlie Hustle,2022,Drama,"A prodigal son, on the run with the woman he loves, turns to a life of crime as an enforcer for a notorious loan shark, his father."
The Reunion,2022,Drama,Ricky Reilly is on a spiritual journey when he runs into his childhood nemesis and is then challenged by his best friend to confront the nemesis at their high school reunion.
Washington's Armor Volume 1 - The Journey,2022,History,Follows the trajectory of George Washington as a boy and a young man as he develops his relationships and ideals.
Gangubai Kathiawadi,2022,"Biography, Crime, Drama","Duped and sold to a brothel, a young woman fearlessly reclaims her power, using underworld connections to preside over the world she was once a pawn in."
Pastor's Wife,2022,Drama,"Monique has always struggled in her role as a pastor's wife. Her husband, Martin, is extremely committed to the church and serving his congregants often to the detriment of his family. When her feelings of insecurity and neglect reach a climax, Monique responds in a manner that will change the course of life as she knows it."
Satria Dewa: Gatotkaca,2022,"Action, Adventure, Drama, Fantasy, Sci-Fi","Legends collide as young Yuda wrestles with his newfound godlike powers, defending his world in an endless battle against ancient and powerful evils."
Elvis,2022,"Biography, Drama, Music","The life of American music icon Elvis Presley, from his childhood to becoming a rock and movie star in the 1950s while maintaining a complex relationship with his manager, Colonel Tom Parker."
Así era,2022,Documentary,
Shut In,2022,Thriller,"When a young mother is barricaded inside a pantry by her violent ex-boyfriend, she must use ingenuity to protect her two small children from escalating danger while finding an escape."
Fate of the Night,2022,"Drama, Horror, Thriller","After witnessing the horrific death of a young woman, the Harris family must face the psychological consequences of leaving her to die."
Ojai,2022,"Drama, Sci-Fi","Ricky and his cancer-stricken mother move to the seemingly innocuous town of Ojai in pursuit of a vague yet promising experimental treatment. As Ricky tries to adjust to his new life, he becomes increasingly skeptical of the town's innocence and concerned for his mom's well-being."
The Four Fathers,2022,Drama,The lives of four fathers find themselves intertwining in a series of events that leads them all to a path of certain redemption.
Vie Feroce,2022,Drama,"Set in the underbelly of Montreal during the early '90s, a street smart teenage girl and her mother must find a way to survive when their world slowly begins to collapse around them."
Sneakerella,2022,"Comedy, Family, Musical",A modern twist on Cinderella set in New York City's Sneaker culture.
Im Westen nichts Neues,2022,"Action, Drama, War",A young German soldier's terrifying experiences and distress on the western front during World War I.
Hello Jindagi,2022,Drama,
Gap Weekend,2022,"Comedy, Romance","A heartbroken guy befriends an offbeat girl after posting his dating manifesto online. As the two spend a weekend together in a pretend relationship, a connection grows that may both heal and complicate aspects of their real lives."
Causeway,2022,Drama,A US soldier suffers a traumatic brain injury while fighting in Afghanistan and struggles to adjust to life back home.
Nothing Compares,2022,"Documentary, Music",Following the career of singer Sinéad O'Connor through her rise to fame and how her iconoclastic personality led to her exile from the pop mainstream.
Bullet Proof,2022,Action,"After stealing millions in cash from the drug hiding place of the sadistic mafia boss Temple, a thief finds a stowaway passenger in his getaway car."
"Bernice, Too",2022,Comedy,Two men. One wheelchair. And a day in their lives - The world is a wonderful and strange place. Let's spend some time in theirs. The newest film from Elmwood Productions. Starring a cast of puppets. Nothing too deep. But just deep enough.
Wyjdź za mnie,2022,"Comedy, Music, Romance","Music superstars Kat Valdez and Bastian are getting married before a global audience of fans. But when Kat learns, seconds before her vows, that Bastian has been unfaithful, she instead decides to marry Charlie, a stranger in the crowd."
Last American Horror Show: Volume II,2022,Horror,This is the sequel to Last American Horror Show.
The Darker the Lake,2022,"Crime, Mystery, Thriller","When strange, supernatural murders suddenly become the talk a peaceful town, two detectives must solve a deadly game, but will the myth of this game reveal secrets too close to home."
Stroke of Luck,2022,Comedy,"Young Nathan has pulled a damaging prank at his school in the city and is sent to his father's farm to work it off. But Nathan finds much more than he bargained for when he gets there, including Sarah, a very charming, independent farm hand, a bizarre crime ring, and a horse that only he can hear talk. Cameo by John Popper - lead singer of the band Blues Traveler. Directed and co-authored by first-time feature filmmaker, Christian Frelinghuysen. Produced by Mark Farrell (Curb Your Enthusiasm, Z Rock). Shot entirely in the Berkshires of Western Massachusetts. [Coming-of-Age Comedy]"
Immenhof - La grande promessa,2022,"Adventure, Drama, Family",
Rat Park,2022,Drama,A recovering addict struggles to save his loved ones when a home invasion goes terribly wrong.
La voluntaria,2022,Drama,"A retired doctor, decides to travel as a volunteer to a greek refugee camp. When she meets young Ahmed, the limits between the need to take care of somebody and of feeling useful begin to fade."
Project Kahuta,2022,"Biography, History, Thriller",A captivating and true case study of espionage webbed around one of the finest operations pulled by India's Research and Analysis wing against Pakistan's top secret nuclear plant at Kahuta.
The Island of Forgiveness,2022,Drama,"Andrea Licari, a Tunisian of Italian descent now 60 years of age, has become an accomplished author, college professor and a leading thinker in Rome. Today, Andrea finds himself facing the most challenging time of his life."
Site,2022,"Horror, Sci-Fi, Thriller","After a terrifying encounter at an abandoned government test site, a small town family man begins seeing haunting visions of a past that threatens to destroy his present."
CryptoKings,2022,Thriller,
The Weary Traveler,2022,Horror,
Expired,2022,"Romance, Sci-Fi","In an uncharted future, two hardened souls meet and confront each other with the things they have done and what they have become."
Strange World,2022,"Animation, Action, Adventure, Comedy, Family, Fantasy, Sci-Fi",The legendary Clades are a family of explorers whose differences threaten to topple their latest and most crucial mission.
Lightyear,2022,"Animation, Action, Adventure, Drama, Family, Sci-Fi","While spending years attempting to return home, marooned Space Ranger Buzz Lightyear encounters an army of ruthless robots commanded by Zurg who are attempting to steal his fuel source."
Path to Midnight,2022,"Crime, Thriller",A home invasion turns deadly when the would be robbers and their targets are held captive by the mob.
Amsterdam,2022,"Comedy, Drama, History, Mystery, Thriller","In the 1930s, three friends witness a murder, are framed for it, and uncover one of the most outrageous plots in American history."
Untitled Disney Live Action Project,2022,"Drama, Mystery, Thriller",
Untitled Disney Live Action Project,2022,,
Alone in the Night,2022,"Horror, Thriller",Stephanie and her friends run into car trouble and stay over at an empty house...or is it?
Big Gold Brick,2022,"Comedy, Fantasy","Fledgling writer Samuel Liston and his experiences with Floyd Deveraux, the enigmatic middle-aged father of two who enlists Samuel to write his biography."
Dampyr,2022,"Fantasy, Horror","Harlan Draka is a Dampyr, half-human and half-vampire, but he doesn't know it. Soon he will have to face his powers to destroy a terrible Master of The Night."
Unplugging,2022,"Comedy, Romance","To revive their marriage and reconnect, a couple takes a self-prescribed digital detox weekend to a remote mountain town. What starts as a perfect weekend getaway without technology quickly spirals out of control."
Levi Roots,2022,"Comedy, Drama",
The Contractor,2022,"Action, Drama, Thriller","A discharged U.S. Special Forces sergeant, James Harper, risks everything for his family when he joins a private contracting organization."
The Final Sacrifice: Directors Cut,2022,Action,"THE FINAL SACRIFICE is a three-sided story about German, Italian, and American soldiers, set in Northern Italy during the final weeks of the World War II."
Major Majestyk: The Power of the Crystals,2022,Sci-Fi,"In a steam-punk world, the incursion by meteorites containing a new power source triggers a global fight for domination."
Paki,2022,"Action, Drama","The story of Israel with his brother Mateo and son Bebo, is on the run from war. After a long journey, they end up in Norway, in a dense small town life in the new city will be a journey from war to a new war."
Etharkkum Thuninthavan,2022,"Action, Crime, Drama, Thriller","A lawyer turns judge jury and executioner and goes after a gang, led by a minister's son, that threatens women with videos of them."
Slugger O'Toole,2022,"Comedy, Drama","Popeye of the Emerald Isle, when Erin first rose, so did he. Slugger doesn't have much need for large dark green leaves but a shot of good Irish whiskey he would rarely refuse. Leaving the place he calls home; turning his back on everything he holds dear - to embrace the uncertainty of a life across the water is no small adventure. His mother has allegedly set up a life in America. At a glance this may appear like clever resolve but a bolder definition presents deeper challenge for the stereotype local boy, drunk as a rule, never backs down from the fight.

Slugger O'Toole isn't just a character in a song, he's a street scrapper and stands undefeated. Fond of his gargle, fond of his ladies, he certainly doesn't turn many corners without his share of drama. Forced into local trouble with the higher ranked paramilitary boys, on both sides, Slugger must now face a quiet exile and is given the choice of anywhere in the world to disappear.

With the potential of family across the water, his exit may be softer than it appears but the problem with geographical solutions - he takes his problems with him. New Orleans has a new set of concerns, and water sinks to its own level.

A new love interest; an ongoing feud with local Cartels; the reunion of family controversy; a well lubricated street fighting career; all contributes to an increasingly fatal alcohol dependency issue, then the demons that accompany that. Slugger is deluded. Just when it all seems to find solution, problems seem to reach their end, the real problem stands face to face with Slugger in the mirror. His fight was within himself."
Stars at Noon,2022,"Drama, Romance, Thriller","A young American journalist stranded in present-day Nicaragua falls for an enigmatic Englishman who seems like her best chance of escape. She soon realizes, that he may be in even greater danger than she is."
Loren & Rose,2022,Drama,"The appetizer is an introduction, the dessert is a farewell in this story of an indelible bond forged between a promising young filmmaker and an iconic actress."
La vaca que cantó una canción hacia el futuro,2022,Drama,"Cecilia travels to her father's farm after he has a heart attack. Back in her childhood home, Cecilia is met by her long-deceased mother whose presence brings to life a painful past chorused by the natural world around them."
Shane,2022,"Documentary, Sport","This will present an intimate portrayal of Warne, the retired Australian cricketer and larger-than-life character whose reputation on and off the green pitch saw his fame transcend cricket."
Disbeliever,2022,Documentary,"Through the lens of American cultural anthropologist and Pultizer Prize-winning author Ernest Becker, DISBELIEVER is a cinematic rumination on human mortality and the lengths to which we go to deny it."
Fisherman's Friends: One and All,2022,"Comedy, Drama, Music","Following the success of their first album, the Fisherman's Friends struggle to adjust to their new-found fame and work towards a second album."
Pada,2022,"Crime, Drama, Thriller","All the governments that have ruled the nation made laws that denied the indigenous people their way of life and their land often, protecting crony capitalist interests. The film revisits an episode of dissent in the 90s which brought up this question amongst us. A history forgotten!"
Hallowtide,2022,Drama,a family divided in small-town USA
The Hit Man,2022,Documentary,"""The Hit Man"" Documentary is about the life and times of Legendary music industry magnate Joe Isgro who picked Hit songs and controlled radio airplay for super star pop artists. The film focuses on Isgro's rise to power culminating in the infamous payola scandals of the 1980's involving all the major music labels, the U.S. Government, and organized crime."
La piel ajena,2022,Drama,
Jayeshbhai Jordaar,2022,"Comedy, Drama",A timid Jayesh must defy his patriarchal family as he flees with his wife to save their unborn daughter from foeticide.
A life like any other,2022,"Documentary, Drama","My father immortalized in family films the most beautiful moments of his life, while my mother's difficulties hit the blind spot of his images. Today, I revisit these images to tell a different story: that of a woman who sees her role as a mother take away her freedom step by step."
Piggy,2022,"Drama, Horror, Thriller",An overweight teen is bullied by a clique of cool girls poolside while holidaying in her village. The long walk home will change the rest of her life.
Bridle,2022,Documentary,"Korean monarchy officially ended in 1911 after Korea annexed by Japan as empire of Japan. Many of monarch family ended up marrying Japanese royalties or aristocrats, some of them still exists in Japan as royal members of Japan. These who still left in Korea were suffered political oppression from Republic of Korean government, and even in North Korea there are some royal members still alive as well, but they're just citizen of North Korea. The world has great interest on South Korean history, it's culture, cuisine and people. South Korea has had such a tragic past and then being ripped apart and abused from 1910-45 to suffer such oppression with no regard what this nation has had to endure!. It's time for it to be healed from these atrocities and openly establish and set the royal family back into it's rightful place."
Brainwashed: Sex-Camera-Power,2022,Documentary,"Investigates the politics of cinematic shot design, and how this meta-level of filmmaking intersects with the twin epidemics of sexual abuse/assault and employment discrimination against women, with over 175 movie clips from 1896 - 2020."
L'homme parfait,2022,Comedy,"Florence, overwhelmed by her family life and her work, decides to buy a robot with a human appearance and a perfect physique. It meets all her expectations: cleaning the house, taking care of the children, and more... But the robot will quickly arouse jealousy in Franck, her unemployed actor husband, I don't care. For fear of losing his wife, Franck decides to take matters into his own hands, especially since the robot seems to find malicious pleasure in causing trouble in their relationship."
Ek Love Ya,2022,"Action, Musical, Romance","Amar, a bright young boy, falls in love with Anitha, but when she rejects his advances, Amar turns into a different person with dim prospects. Produced by Rakshitha Prem, it is touted to be a musical love story."
Atlas of Iladrael,2022,Fantasy,"A man named Atlas wakes up in the strange testing facility of a corporation researching immortality. With no memory of his life before this, Atlas will explore philosophical questions, unrequited love, and the six mysterious Guardians of a mystical forest named Iladrael. A nihilistic mythological fantasy, this film will incorporate surreal imagery, cryptic symbolism, and the fateful consequences of actions. Now in Pre-Production."
Honest to God,2022,Comedy,"When a family man finds out he was misdiagnosed with a terminal illness, he must now make good on the promises he made to God if he were to be healed."
Prindey,2022,Action,
Django/Zorro,2022,"Adventure, Drama, Western","Several years after the events of Django Unchained (2012), Django meets Don Diego de la Vega, the famed Zorro, and agrees to become his bodyguard on a mission to free the local aboriginal population from slavery."
Aylan Baby,2022,"Action, Crime, Drama","Alan Kurdi (Kurdish: Alan Kurdî ), initially reported as Aylan Kurdi, was a three-year-old Syrian - The bodies of Kurdi and another child were discovered by two locals at around 6:30 am. The two men moved the bodies from the water,"
Maurice le chat fabuleux,2022,"Animation, Adventure, Comedy, Family","This story follows Maurice, a goofy streetwise cat, who has the perfect money-making scam. He finds a dumb-looking kid who plays a pipe and has his very own horde of rats, who are strangely literate."
Evil in Plain Sight,2022,Drama,"When FBI agent Darren Kimble, along with his partner Samantha Shaw, a former child victim of trafficking, gets wind of a deranged serial killer slaying innocent women that are believed to be engaging in sex against their will in The Red Light District of Houston, TX, he teams up with local law enforcement before a dangerous killer strikes again."
The Year of the Soul,2022,"Comedy, Drama","A drama-comedy centered on a group of American expatriate friends living in Berlin, depicting their dilemmas, aspirations and their search for a meaningful life."
Nightline,2022,"Crime, Thriller","Under Czech law, most murders can be statute-barred in as little as 20 years. Radio presenter Eva gets involved in one case that is time-barred almost irretrievably. On her nightly show, she gives space to the mysterious Radek, who has returned to Prague after exactly twenty years."
Unbound Evil,2022,"Horror, Mystery","While witnessing a horrific paranormal occurrence inside an abandoned church, a military commando led by a ruthless colonel, discovers a digital tablet with video footage on it: co-workers filming their trip in the woods, connecting the hikers in the footage with the unbound evil inside the church."
Ammonium Nitrate,2022,Action,"Jesse James Price has a passion for chemistry, this leads him to become the proprietor of a schoolyard explosives factory. One of his customers Brittney, is being harassed by a local boy she purchases a chemical cocktail from Jesse hoping to scare the harasser away. Jesse sets fire to his school, and this pushes his already strained relationship with his foster parents, the abusive and pious Donny and Martha Wainwright to breaking point.

Rickson O'Connor and Jesse have been together since their first foster home, the boys are closer than brothers and view each other as the only real family they have. Rickson is a teenage boxing prodigy, and his trainer Bobby is confident that his skills will carry him to eternal glory in the boxing halls of fame, so confident in fact that he mortgages his gym to send the young pugilist to the British Boxing Academy in London. This places Rickson in an awkward dilemma, between chasing his dream and leaving his brother.

Sergeant Culver Simpson, a homeless war veteran turns up at the Wainwrights one morning, drunk and crazy he rattles on the door until a sleepy Jesse answers. Culver barges his way inside and proceeds to tell Jesse the story of his father, Captain Jens Price, how they fought together and how he died, before his death Jens Price gave Culver a compass, Culver passes this compass to Jesse but is interrupted by a furious Donny and is forced to depart. Donny turns his anger to Jesse and begin to beat the boy. Rickson intervenes and punches Donny. The boys are forced to flee the house for the safety of Jesse's Laboratory/shed. Jesse begins to inspect the compass, he finds a small map wedged behind the compasses housing, Jesse reads a note written on the back of the map, it's from his father.

The note tells Jesse of a footlocker buried underneath a waterfall in the middle of a vast wilderness. Jesse and Rickson immediately begin preparing for an expedition. Jesse and Rickson are forced to return to the Wainwrights for supplies, along the way the encounter Brittney, who is furious that the cocktail she bought from Jesse has hospitalized the young boy. Jesse ignores her and sneaks back into the Wainwrights home to discover Antonius a grizzled, knife wielding south African war veteran and ex-comrade of Jesse's father, Antonius wants the map, and he tries to take it but Jesse escapes and along with Rickson and Brittney, sets off on an adventure to find the mystery box. Antonius searches Jesse's laptop and recovers a copy of the map, he sets off after them. As Jesse, Rickson and Brittney move further into the wilderness it becomes apparent that love is blossoming between Rickson and Brittney.

Jesse becomes increasingly bitter and jealous leading to a fight between him and Rickson. Furious at his brother Rickson tells Jesse about the British Boxing Academy and that he is leaving for London as soon as they get back. Jesse punches his brother then departs to find the mystery box on his own. Rickson and Brittney decide to return home in the morning, but during the night Antonius attacks, after beating Rickson in a fight, the ex-soldier proceeds to march the teenagers through the wild in search of Jesse and the box. Jesse locates the waterfall and the box; Jesse opens it and finds his father's diary and a cache of uncut diamonds. Antonius decides to set a trap for the young boy, using Rickson and Brittney as bait. The trap backfires, Jesse, Rickson and Brittney escape and are chased by Antonius back to the waterfall. Antonius finds the mystery box and Jesse convinces the man to open it.

Antonius opens the box, and it explodes, rigged with one of Jesse's homemade explosive devices, the blast kills Antonius and the teenagers come out of the wilderness changed by their experience. Jesse accepts his brothers need to move on and the pair go their separate ways."
Broken,2022,Thriller,"A detective interrogates a woman with the help of a psychiatrist, meanwhile attempting to uncover the truth behind a murder case"
King Size,2022,"Comedy, Fantasy",
Blasé L.A.,2022,Drama,
North Central,2022,Drama,"North Central is a coming of age dramatic comedy that takes us into the hearts and minds of inner city youth who stand on the doorstep of life and are still trying to figure out how to ring the doorbell. In the end, we realize that some are chosen and others sit in the stands."
The Coven,2022,Horror,A devoted couple's quiet weekend takes a bizarre turn when a nightmarish cult and their maniacal leader come to fulfill an apocalyptic prophesy.
Hoodie,2022,Drama,Three friends go for a night on the town in order to help their friend get over what seemed to be the perfect relationship.
Padavettu,2022,"Action, Drama, Thriller","The coming of age drama portray the relentless pursuit of the layman, the oppressed section of society who is in a constant struggle and fight to reclaim their unique identity and rightful place in a world meant for all."
Champagne!,2022,Comedy,"Springtime in the French vineyards of Champagne. Patrick has gathered his oldest friends for his bachelor party. The trouble is, everyone hates his future wife. This could thus become one hellish weekend in gourmet paradise."
