title,year,genre,plot
Exposure 36,2022,"Sci-Fi, Thriller","Three days before the world is set to end, a photographer is drawn into New York's criminal underworld after his friend goes missing."
On Sacred Ground,2022,Drama,A journalist and oil company executive find themselves on opposite sides of the fight during the construction of the contentious Dakota Access Pipeline that runs through the Standing Rock Indian Reservation in North Dakota.
A Fada do Lar,2022,Comedy,
Maigret,2022,"Crime, Drama","In Paris, a young girl is found dead in a Parisian square, wearing an evening dress. Commissioner Maigret will try to identify her and then understand what happened to the victim."
The Pack,2022,Documentary,"Inmates have a task to train truculent dogs. Capitan Tomek, who is a leader of this program in the prison, struggle to keep the project running. Prisoners start to bond with their dogs and dogs start to change inmates live."
O Palestrante Motivacional,2022,Comedy,"Touched by the lack of perspective in his life, the accountant Guilherme takes the place of Marcelo without even knowing the real Marcelo is a motivational speaker."
Shame,2022,"Horror, Mystery, Thriller","Freud's essay on anxiety, guilt, and shame, perfectly fits on this middle class Indian housewife, who's guilt when turns into shame, creates a monster which is uncontrollable ."
Ancestors from the Stars,2022,Adventure,"An unexpected encounter with an otherworldly visitor, leads a narrow-minded widowed Native American on a path of self-awakening, in order to save not just his ill-fated buddy but also the rest of humanity."
Mind-Set,2022,"Comedy, Drama","Lucy, a disillusioned office clerk who lives in a dysfunctional relationship with her slovenly partner Paul, is surprised to find herself on the cusp of a none-too-secret affair with her new work colleague, Daniel. The thrill of the chase for a shred of affection takes her mind off her problematic life but she's not sure that she'll ever leave Paul, or that sex with someone else is the true answer to her problems."
Dhaakad,2022,"Action, Thriller","Agent Agni, a highly trained and deadly field agent is entrusted with the mission to gather Intel and eliminate Rudraveer, an international human and arms trafficker who has been off the radar for ten years."
Humanity Stoked,2022,Documentary,"The beauty in overcoming fear and other challenges facing humanity as seen by icons of pro skating, science, art, music, activism, and education, all of whom share experiences and perspectives shaped by their love of skateboarding."
Veyil,2022,"Drama, Thriller","Karthi and Sidhu live with their mother. As a family, how they face life and deal with all the challenges thrown at them is what forms the crux of the story."
The Kybalion,2022,"Documentary, Fantasy","This film is an adaptation of the 1908 occult manuscript, The Kybalion - and explores the 7 principles of Hermetics. It is a surreal documentation of the supernatural world around us."
Divine Telepathy,2022,Drama,"On a search to find her true calling in life she discovers a truth about her birth mom - through her passing. Not only does she discover her origin, but she discovers a shared history with siblings she has never known."
A Walk in the Park,2022,"Comedy, Romance","Nate, a suicidal 28 year old incidentally finds the beauty in life after mysteriously waking up naked in a park and discovering he is involved in a marijuana heist. Nate is forced to find a special ""pillowcase"" he lost the night before which is hidden somewhere in the park. He embarks on a journey by putting the puzzle pieces together while encountering a variety of people who include the girl of his dreams and his menacing landlord. All Nate wants to do is get through the day however it may not be that easy."
Lecciones para canallas,2022,Comedy,"Fate leads young Jenny to search for her estranged father: small-time swindler Dirty Barry. Jenny believes love conquers all, but Barry knows money is what makes the world go round. Let the lessons for scoundrels begin."
The Surrogate,2022,Horror,A ghost horror about a mother who falls mysteriously ill and struggles to stop her family from being destroyed.
Wikipedia,2022,,
Babylon,2022,"Comedy, Drama, History","A tale of outsized ambition and outrageous excess, it traces the rise and fall of multiple characters during an era of unbridled decadence and depravity in early Hollywood."
Dhokha: Round D Corner,2022,"Crime, Thriller","When a housewife with a personality disorder is taken hostage by a terrorist on the loose and a husband accused of cheating on his wife, have their own versions of reality, how do we know what the truth is? Dhoka Round D corner is a tale of lies and harsh truths."
Thor: Love and Thunder,2022,"Action, Adventure, Comedy, Fantasy, Romance, Sci-Fi","Thor enlists the help of Valkyrie, Korg and ex-girlfriend Jane Foster to fight Gorr the God Butcher, who intends to make the gods extinct."
Side Effects,2022,Drama,"Alex, a gay college sophomore, attempts to ignore his unrequited feelings for the love of his life by making a superhero film with his friends. As his movie unfolds, so too does the possibility of a new relationship."
Wings Over Water,2022,Documentary,"A documentary filmed in stunning 3D high definition for IMAX. This film will showcase millions of migratory birds, the importance the wetlands of the upper midwest play in their lives, and dangers to the continued existence of the Prairie Pothole region that is so crucial to the future of migratory birds in North America."
Halloween Ends,2022,"Horror, Thriller",The saga of Michael Myers and Laurie Strode comes to a spine-chilling climax in the final installment of this trilogy.
Hometown: Sins of the Fathers,2022,Drama,
Wicked Game,2022,"Action, Romance, Thriller","An electrifying thrill-ride is unfolding with propulsive energy, unexpected twists and breathtaking action."
Campo de Sangue,2022,Drama,
Women of Phantasm: The Documentary with Balls!,2022,"Documentary, Horror","There have been over 144+ women in 40+ years in front of and behind the camera on the world renowned horror series, ""Phantasm."" This is their story."
Para-Psych Trauma,2022,Horror,
Nikamma,2022,"Action, Comedy, Drama",A lazy slacker struggles to get along with his diligent sister-in-law - until they must step up and fight together against a common enemy.
The White Rider Returns - A Sean Hunt Film,2022,Western,"In the Old West, the adventure continues as our Heroes attempt to set free the negro slaves of Bernie William's Family and once again face the sinister Grisham Clan."
Entergalactic,2022,"Animation, Comedy, Music, Romance","Jabari, a charming, streetwear-clad artist on the cusp of real success. After a chance run-in with his cool new photographer neighbor, Meadow, Jabari has to figure out whether he can make space for love in his life."
Slovo,2022,Drama,"The story of the intended feature film The Word (Slovo: originally His Word, Her Word) depicts the lives of Mr. and Mrs. Vaclav Vojir and Vera Vojirova, their family and their immediate surroundings between the summer of 1968 and the summer of 1969."
Rucker,2022,"Drama, Horror, Thriller",A trucker attempts to reconnect with his family by killing women who remind him of his ex-wife.
Ghoul,2022,Horror,"Karla, a free-lance photographer moves into a new house in Las Vegas and thinks it's haunted. A few people (a low-life thief, a creepy handy-man, an angry nosy neighbor, and a few more) get brutally murdered by something horrible that is living in the attic. GHOUL will make you want to sleep with the lights on."
Ponniyin Selvan: Part I,2022,"Action, Drama, Family, Fantasy, History","Vandiyathevan sets out to cross the Chola land to deliver a message from the Crown Prince Aditha Karikalan. Kundavai attempts to establish political peace as vassals and petty chieftains plot against the throne. Unrest grips the land as a long-tailed comet arrives, signalling a time of turmoil."
K.G.F: Chapter 2,2022,"Action, Crime, Drama, Thriller","In the blood-soaked Kolar Gold Fields, Rocky's name strikes fear into his foes. While his allies look up to him, the government sees him as a threat to law and order. Rocky must battle threats from all sides for unchallenged supremacy."
Bachchhan Paandey,2022,"Action, Comedy, Crime, Drama","When a struggling filmmaker and actor set out to make a biography on one of the most dreaded gangsters, they have little idea about just how crazy and dangerous it's going to be."
The Book of Harth,2022,Documentary,A New York City-based conceptual artist embarks on a 20-year art project asking culturally significant people to sign his copy of The Holy Bible.
Nightmare of Alice,2022,Horror,
Sexagenarian,2022,"Comedy, Drama",A lonely sixty year old woman finds a new perspective on her life when an unexpected teenager appears on her doorstep. This troubled young man forces her to confront and question her personal history.
Three Losses,2022,Documentary,"Three stories. Florence organises a concert in memory of her fiancé Joseph Leon and shares her memories. Tibetans work hard to revive their ancient opera, Ache Lhamo, in Dharamshala. Filmmaker struggles between losing identity and effects of post-colonialism and draws an essayist comparison between Mumbai and London."
Horror Express,2022,"Horror, Sci-Fi","Archaeologists board a train with the remains of an ancient creature. But during the trip, the monster thaws out and seeks to absorb the life force of every passenger who crosses it's path."
Look at Me: XXXTentacion,2022,"Documentary, Music","An inside look at a gifted young rapper's tumultuous coming-of-age with never-before-seen footage, as XXXTentacion's inner circle speaks out for the first time."
Charlotte,2022,Horror,
Il Boemo,2022,"Biography, Drama, History, Music","Looking for work as a violinist, Josef comes into the orbit of a rich young woman. She introduces him to a hedonistic existence free from religious intolerance. Josef gets an incredible commission: to write an opera for the San Carlo."
"Nie martw się, kochanie",2022,"Drama, Thriller",A 1950s housewife living with her husband in a utopian experimental community begins to worry that his glamorous company could be hiding disturbing secrets.
Gehraiyaan,2022,"Drama, Romance",Takes you on a journey into the deep rooted intricacies of modern human relationships.
Shin Ultraman,2022,"Action, Adventure, Drama, Fantasy, Sci-Fi","As the threat of giant unidentified lifeforms known as ""S-Class Species"" worsens in Japan, a silver giant appears from beyond Earth's atmosphere."
Creatures of Necessity,2022,"Comedy, Crime, Thriller","After 13 days without receiving a ransom and their identities unveiled, everyone involved with the kidnapping of Isabella Contini, hit their breaking point."
Graves,2022,"Action, Crime, Drama","Graves Police Officer, Mark Brody, embarks on a journey to bring criminals to justice while Michael Laforte is the hard-drinking, ruthless criminal mastermind who doesn't play by the rules. Clyde Baxter, Matt Goldberg, Pedro Dominguez and the rest of a gang of ex-military men use their expertise and tactical skills to evade the law. His crew soon finds themselves on a direct collision course with Special Agent Mark Brody and the Graves Task Force as the criminals hatch an elaborate plan for a seemingly impossible heists all around the city."
Abiding,2022,"Action, Crime, Drama, Thriller",A mobster must save his family from paying the ultimate price for his sins when a killer from his past is on a sworn mission to wipe each one of them out.
Persona,2022,"Drama, Romance, Thriller","A Man forms a passionate and sensual relationship with a woman in his dreams, upon waking up he must deceive his surreal hallucinations and Insomnia to find a way to re-unite with her again."
Serdtse parmy,2022,"Drama, Fantasy, History","The 15th century. Sent to remote Parma by the Grand Prince of Moscow, prince Yermolay tells his son Mikhail about his dream: to create a grand princedom that would unite the peoples inhabiting these lands. Soon Yermolay is killed in the battle against the rebellious local tribes, the Voguls. His heir Mikhail finds himself in the middle of two worlds - the Grand Duchy of Moscow and the ancient lands of Perm populated by pagans. Mikhail marries a local girl, Tiche, a half woman, a half lamia - a witch, a living incarnation of the main pagan symbol Golden Woman, Sorni Nai. The legend has it that whoever owns Sorni Nai, has the full control over Parma. A talented diplomate, Mikhail finds allies among the local khans. He is able to bring a fragile peace but the news about the increasingly powerful Permian Prince reaches Moscow. The Grand Prince Ivan III decides to overpower Mikhail and his allies. He intends to turn disparate Rus into a uniform and strong state, realizing that the peoples can't repel the endless invasions of the Russian lands on their own. Mikhail has a difficult choice to make: to accept the will of Moscow or to stick with the local rulers who had helped him more than once in the past and many of whom became his loyal friends. Mikhail decides to listen to his heart and not the reason and ultimately loses the battle against the Grand Prince of Moscow and with his friends and allies ends up in captivity. In the meantime, Tiche is kidnapped by Mikhail's bitter enemy Assyka who wants to regain his control over Parma, believing that Tiche the lamia is his and his alone."
Immigrant,2022,Drama,
Golden Threads: The Tailor-made Revolution,2022,Documentary,
Making Friends as the World Ends,2022,Drama,
Suitable Etc.,2022,"Comedy, Romance","A young Indian American expat navigating traditional arranged marriage matchmaking dodges bullets, spots red flags, falls in love, and comes to terms with her heritage and cultural identity."
Come Out Fighting,2022,"Action, Adventure, Drama, History, Thriller, War","Late 1944 during WWII, the American army have raced their way through the countryside on the border of France entering Nazi Germany. Hitler desperate to turn the tide, has deployed his secret weapon: an M-262 fighter jet. Lieutenant Frank Ross, a P-51 Mustang fighter pilot, encounters a Nazi weapon, and an intense aerial battle quickly ensues. Lieutenant Frank Ross is unsuccessful in the fight and is forced to eject from his own plane, landing himself behind enemy lines. Waiting for a rescue team, Frank finds himself in the middle of a German ambush against an American Tanker Patrol. Leading the USA Patrol is the 2nd Lt. Robert Hayes along with his right hand soldier, ""Sergeant A.J. Red McCarron and also Private Michael ""Salty"" Buttons serving the famed 761st Tank Battalion known as ""The Black Panthers."" Buttons and the others must find a way to put differences aside and band together to win this war."
BD Scream 7,2022,Horror,
Octopus Pot,2022,Drama,"A broken man finds the one thing he can't live without only to lose it. He can't bring back the woman he loves, but he can cover the ground with the blood of his enemy."
Diary of a Spy,2022,"Drama, Mystery, Romance, Thriller","A washed-up intelligence officer is given the chance for one last mission, recruiting an asset connected to the Saudi Royal Family."
The Janus Perspective,2022,Horror,"Three friends are confined to a small cabin where the outside world is haunted by those who did not survive. Their patience and fortitude are tested daily, as they must navigate this nightmarish world as well as each other."
Valimai,2022,"Action, Crime, Thriller","Arjun, an IPS officer sets out for a mission on hunting down illegal bikers involving in theft and murder."
Vertical,2022,"Adventure, Fantasy, Horror, Mystery",Rita is the daughter of a family carrying and ancient blood with extraordinary abilities. Every 100 years they need to sacrifice to protect the people. The destiny brings her to a rocky vertical mountains where the monsters lives.
The Last Fighter,2022,Action,"Mark is an intelligent lawyer and Martial Artist who becomes a Martial Art Champion. Mark is introduced to a Masonic Organization where he fights for a lot of money against criminals who want to win for their freedom. Mark uses his winnings to help associations that deal with poor children in the world, in which his girlfriend Aurora is also a part of. During the fights Mark will go through many emotions and challenges to the death of his opponents."
CAT 6,2022,"Horror, Thriller",What should have been a lovely vacation in the sunshine state turns into a nightmare of catastrophic proportion when strangers find themselves trapped it what seems and endless moment in time.
The Kashmir Files,2022,Drama,"A heart-wrenching tale that captures the pain, suffering, and struggle of the Kashmiri Pandit community in 1990 and leads Krishna, a young college student, to set out on a quest to uncover the truth."
The Lost Cult,2022,Horror,"In the summer of 2021, six students decide to go to summer camp in the United States. Once settled, they will realize that they are not alone in the camp, and that the past comes back to haunt them one by one."
Forever Young,2022,Documentary,On the 29th February 2020 Karen Tinsley-Sroka celebrates her birthday in style aboard a cruise ship in The Bahamas with seventy-seven other Leap Year Babies.
Hope's Song,2022,Drama,"Cameron Ryder is a semi famous singer who is about to release his new album. His girlfriend Hope is facing a serious medical diagnosis no one saw coming. With the help of his entire family, they begin the treatment process, which draws Hope and Cameron even closer. Will their love be able to survive?"
A Strippers Prayer,2022,Drama,
Leonardo and the Love,2022,"Comedy, Drama, Romance","A man, quiet, unassuming and recently heartbroken is leaving his cherished life and love in a charming Italian town, when he discovers a kitten trapped in a drainpipe, tries to rescue the exhausted creature and maybe his relationship."
The Unwanted,2022,Horror,
Diorama,2022,Romance,"It follows Frida and Björn's love story, from passion to marriage to family life, from a scientific perspective."
EAMI,2022,Drama,"Eami's homeland is invaded by settlers. Embodying Asojá, the bird-god-woman, she falls into trance in which she walks slowly and stunned through her beloved forest as she prepares to leave it forever."
The Marsh,2022,Horror,
Fuhgedd About It,2022,Drama,"A bloody tale of an underground mafia crew that rose to power in a volatile world while building a criminal empire in the heart of New Jersey and surrounding New York areas. As the crew prepares for a hostile takeover, survival pf the fittest in a deadly never ending war zone results in a head to head showdown with one of the most ruthless Mexican drug cartels east of the border. All the while, another deadly mafia crew out for blood, threatens the remaining territory. To make matters even worst, Undercover FBI investigators move in to try to infiltrate the organizations. As time passes with an abundance of money in circulation, the death toll continued to climb at an all time high and the ultimate betrayal sets in. This suspenseful cat and mouse chase is based on a true story. Never before has there been a mafia story that's been so riveting and captivating. But as the saying goes, every great empire always takes a fall in the end or....Fuhgeddaboudit."
Stay with Me,2022,Drama,"A woman with an undiagnosed mental disorder struggles to survive with her illness, while her best friend and boyfriend struggle as they learn to be her advocates."
Heavy Vibes - The Vince Montana Retrospect.,2022,Documentary,"A look back and forward on the musical legacy of M.F.S.B. original member and creator of The Salsoul Orchestra Vince Montana, Jr. and his fight for his share of recognition, fame, and fortune or risks fading in obscurity."
Krime Story,2022,"Comedy, Crime, Drama","A small-time thief and his best friend get hired to rob a wealthy businessman, but things start to go sideways once the job is done."
Raspberry1508,2022,"Drama, Sci-Fi","Set in near future, a brave woman discloses the truth about the creation of the The Perfect Human, and is forced to fight for her life."
Megalomaniac,2022,Horror,Megalomaniac questions the invisible line between victim and executioner and how it is crossed. A film about the weight of patriarchy and the illusion of Manichaeism
The Street Avenger,2022,"Action, Adventure, Crime, Thriller","When a young girl being raised by a single father loses him to gang violence, she turns to law enforcement, but they are no help. She tries to take the law into her own hands and finds out being a vigilante is nothing like she reads about in the comics. Rosie (played by Karina Encarnacion) quickly finds herself caught in a war between two rival gangs while trying to stay two steps ahead of the police. This is a raw, action-packed adventure that shows the inner strength of a young woman that will stop at nothing to avenge her father."
Herseye Ragmen,2022,Drama,"""Your scar becomes who you are."""
The Black Caesar,2022,"Action, Crime, Drama",Hit man Tommy Walker becomes a notorious black mob leader on the streets of New York City.
Volkov Origin,2022,Thriller,"In the late evening hours, Dr. Angela Perkins finds that she has a new assignment. To dive into the mind of Horton House Penitentiary's newest and most mysterious tenant, Andre Volkov . No one can anticipate the impact that her visit will have on both of their lives as she begins her quest for the truth within his answers. Blinded by his past, Volkov slowly resurrects his tale of emotional, mental, and physical abuse through his own words. His origin story. However, through uncontrollable rage, Volkov breaks his chains only to slip back into the criminal underground where he reunites with his most trusted leader, Brutus, and his crew. What follows is a roller coaster ride of suspense in this psychological thriller that's sure to leave you questioning your own sanity."
His Answer the Movie,2022,Drama,
Nanny,2022,"Drama, Horror, Thriller","Immigrant nanny Aisha, piecing together a new life in New York City while caring for the child of an Upper East Side family, is forced to confront a concealed truth that threatens to shatter her precarious American Dream."
Occhiali neri,2022,"Horror, Mystery, Thriller","Diana, a young woman who lost her sight, finds a guide in a Chinese boy named Chin. Together they will track down a dangerous killer through the darkness of Italy."
Kira & El Gin,2022,"Action, Drama, History, Thriller",Two men team up to fight against British occupation in Egypt during the 1919 revolution.
Legends and Idols,2022,"Documentary, Biography","Armed with just his talent, follow Willard Snow as he attempts to open an art gallery, while painting portraits of Rock Star Legends on canvass and instruments. This is the American Dream rising out of paint and iphones."
Final Dress,2022,Horror,"Theatre camp is all fun and games until the creepy acting teacher shows up and the killing begins. Final Dress is a horror movie that takes on current social issues in the performing arts, while drawing inspiration from classic slasher films, old ghost stories, and even some Broadway musicals."
Back to Billy,2022,Drama,
Morjim,2022,"Crime, Mystery, Thriller","A mysterious man (Ziggy) takes the help of a con-man to catch a Russian drug lord that rules North Goa, and who no one has seen."
Widows Walk (The Killing Time - Part 2),2022,Action,
Head Case: The Lost Tapes,2022,"Crime, Horror, Mystery",
Hommes au bord de la crise de nerfs,2022,Comedy,
El Houb,2022,Drama,Moroccan-Dutch Karim returns to his family home and opens up to his parents about being into men. Their reaction inspires a journey of discovery through Karim's isolation as he attempts to break an ingrained culture of silence.
Bristol Fashion,2022,Drama,A young transgender woman escapes her troubled home to find solace in a dilapidated boatyard.
Untitled Universal Musical Event,2022,,
Nope,2022,"Horror, Mystery, Sci-Fi, Thriller",The residents of a lonely gulch in inland California bear witness to an uncanny and chilling discovery.
Sylvester Both Sides,2022,Biography,
Untitled Disney Live Action Project,2022,,
Untitled Illumination Animated Film,2022,,
Flaca,2022,Drama,
Untitled Universal Event Film,2022,,
Untitled WB Event Film (November 2022),2022,,
Timebomb,2022,Thriller,"During an air b&b weekend away to grade papers, Professor Cooper Franklin faces an EMP that takes down the power grid. Cooper is joined by his host, Dex Mandell, to face the first 72 hours of chaos and violence that's sweeping the Nation."
The Journey of Gabe,2022,"Comedy, Drama, Fantasy",
Il sesso degli angeli,2022,Comedy,"The attentive parish priest Don Simone must recognize that no one in his small people is really interested in religion. Despite his efforts, he cannot convince the boys to attend church."
Love Feast,2022,Romance,
Chess Man,2022,,
Tribute,2022,Horror,Imitation is the highest form of flattery and these murders are the highest form of imitation.
Veerame Vaagai Soodum,2022,"Action, Thriller",A normal man from a middle-class family questioning the authorities for abusing their powers.
Utama - Le terre dimenticate,2022,Drama,"In the Bolivian highlands, an elderly Quechua couple has been living the same daily life for years. During an uncommonly long drought, Virginio and his wife (Sisa) face a dilemma: resist or be defeated by the environment and time itself."
La Vida en el Silencio,2022,Drama,"A single parent musician battles every day to communicate with his autistic son through music, until one day the child´s mother shows up after eight years of absence, only to reveal a secret that he might change his life as he knows."
The Killing Time,2022,Action,
